{
 "id": "wa-motorcycle-2w",
 "name": "Washington motorcycle knowledge tests (2-wheel)",
 "description": "Questions from the Washington DOL Motorcycle Operator Manual for the two-wheel motorcycle knowledge tests. A 2-wheel endorsement takes four tests at a DOL partner training school: the permit knowledge test (50 multiple-choice questions, pass with 80%) and permit skills test, then the endorsement knowledge test (25 questions, pass with 68%) and endorsement skills test. DOL does not publish its test questions, so these are written from the manual.",
 "source": {
  "name": "Washington State Department of Licensing, Motorcycle Operator Manual",
  "url": "https://dol.wa.gov/driver-licenses-and-permits/motorcycle/motorcycle-endorsement-training-and-testing/motorcycle-operator-manual"
 },
 "updated": "2026-10-19",
 "questions": [
  {
   "id": "q1",
   "prompt": "What do you need to ride a motorcycle legally on Washington roads?",
   "answers": [
    "A motorcycle instruction permit or endorsement"
   ],
   "wrong": [
    "A regular driver license and motorcycle insurance",
    "A safety course certificate and a helmet",
    "A motorcycle registration in your own name"
   ],
   "explanation": "A permit or endorsement is required on public roads, on top of your driver license.",
   "tags": [
    "Licensing and law"
   ]
  },
  {
   "id": "q2",
   "prompt": "What can happen to your motorcycle if you ride it on public roads without the required permit or endorsement?",
   "answers": [
    "It may be impounded"
   ],
   "wrong": [
    "Nothing, if you have insurance",
    "It gets a warning sticker",
    "Its registration is cancelled"
   ],
   "explanation": "Riding without a permit or endorsement can get the motorcycle impounded, and the minimum fine is $389.",
   "tags": [
    "Licensing and law"
   ]
  },
  {
   "id": "q3",
   "prompt": "What is the minimum fine for riding without a motorcycle endorsement?",
   "answers": [
    "$389"
   ],
   "wrong": [
    "$50",
    "$124",
    "$1,000"
   ],
   "explanation": "The manual gives $389 as the current minimum fine.",
   "tags": [
    "Licensing and law"
   ]
  },
  {
   "id": "q4",
   "prompt": "What is the minimum age for a motorcycle instruction permit?",
   "answers": [
    "16"
   ],
   "wrong": [
    "15",
    "17",
    "18"
   ],
   "explanation": "You must be at least 16 and hold a current Washington driver license.",
   "tags": [
    "Licensing and law"
   ]
  },
  {
   "id": "q5",
   "prompt": "Who may ride as a passenger with a motorcycle instruction permit holder?",
   "answers": [
    "Nobody, permit holders may not carry passengers"
   ],
   "wrong": [
    "Anyone wearing a DOT-compliant helmet",
    "Only a rider with a full endorsement",
    "Only family members over 16"
   ],
   "explanation": "A permit allows no passengers and no riding at night.",
   "tags": [
    "Licensing and law"
   ]
  },
  {
   "id": "q6",
   "prompt": "When may a motorcycle instruction permit holder ride?",
   "answers": [
    "Only in daylight, not at night"
   ],
   "wrong": [
    "Any time",
    "Only on weekends",
    "Only with an endorsed rider following"
   ],
   "explanation": "Permit holders may not ride at night or carry passengers.",
   "tags": [
    "Licensing and law"
   ]
  },
  {
   "id": "q7",
   "prompt": "How long is a motorcycle instruction permit valid?",
   "answers": [
    "180 days"
   ],
   "wrong": [
    "30 days",
    "90 days",
    "1 year"
   ],
   "explanation": "A permit lasts 180 days and can be renewed once before it expires.",
   "tags": [
    "Licensing and law"
   ]
  },
  {
   "id": "q8",
   "prompt": "How many times can you renew a motorcycle instruction permit?",
   "answers": [
    "Once, before it expires"
   ],
   "wrong": [
    "Never, you must retest",
    "Twice, within 5 years",
    "As often as you like"
   ],
   "explanation": "You can renew once before it expires; if it lapses, you retest for a second permit. You may hold only 2 permits in 5 years.",
   "tags": [
    "Licensing and law"
   ]
  },
  {
   "id": "q9",
   "prompt": "How many motorcycle instruction permits may you hold within 5 years?",
   "answers": [
    "2"
   ],
   "wrong": [
    "1",
    "3",
    "No limit"
   ],
   "explanation": "Only 2 permits in a 5-year period.",
   "tags": [
    "Licensing and law"
   ]
  },
  {
   "id": "q10",
   "prompt": "What must riders under 18 do before applying for a motorcycle endorsement?",
   "answers": [
    "Complete an approved safety course, with a parent’s permission"
   ],
   "wrong": [
    "Hold a permit for a full year with no tickets",
    "Ride with an endorsed adult for 50 hours",
    "Pass the skills test twice in a row"
   ],
   "explanation": "Under-18 riders need an approved safety course and parental permission for the course and the endorsement.",
   "tags": [
    "Licensing and law"
   ]
  },
  {
   "id": "q11",
   "prompt": "Do you have to take a training course to take the motorcycle permit or endorsement tests (if you are 18 or older)?",
   "answers": [
    "No, training is not required"
   ],
   "wrong": [
    "Yes, always",
    "Only for the endorsement",
    "Only for the permit"
   ],
   "explanation": "Training is optional for adults, though the tests are taken at a DOL partner training school.",
   "tags": [
    "Licensing and law"
   ]
  },
  {
   "id": "q12",
   "prompt": "Where do you take Washington motorcycle permit and endorsement tests?",
   "answers": [
    "At a DOL partner training school"
   ],
   "wrong": [
    "At any police station",
    "Online at home",
    "At the motorcycle dealer"
   ],
   "explanation": "All the tests are given through DOL partner training schools.",
   "tags": [
    "Licensing and law"
   ]
  },
  {
   "id": "q13",
   "prompt": "After passing the required tests, how long must you wait before adding the endorsement at a licensing office?",
   "answers": [
    "3 business days"
   ],
   "wrong": [
    "No wait",
    "1 week",
    "30 days"
   ],
   "explanation": "There is a 3-business-day wait. Passing results are good for 180 days.",
   "tags": [
    "Licensing and law"
   ]
  },
  {
   "id": "q14",
   "prompt": "Do 2-wheel and 3-wheel motorcycles need separate endorsements in Washington?",
   "answers": [
    "Yes, each has its own tests and endorsement"
   ],
   "wrong": [
    "No, one endorsement covers every motorcycle",
    "Only for sidecar rigs, not trikes",
    "Only if the engine is over 150 cc"
   ],
   "explanation": "A 2-wheel and a 3-wheel endorsement are separate.",
   "tags": [
    "Licensing and law"
   ]
  },
  {
   "id": "q15",
   "prompt": "Is liability insurance required for motorcycles in Washington?",
   "answers": [
    "Yes, it is mandatory"
   ],
   "wrong": [
    "No, it is optional",
    "Only for passengers",
    "Only for bikes over 500 cc"
   ],
   "explanation": "Liability insurance is mandatory for all motorcycles (RCW 46.30.020).",
   "tags": [
    "Licensing and law"
   ]
  },
  {
   "id": "q16",
   "prompt": "When may motorcycles use HOV (diamond) lanes in Washington?",
   "answers": [
    "At any time"
   ],
   "wrong": [
    "Never",
    "Only at rush hour",
    "Only with a passenger"
   ],
   "explanation": "Motorcycles may use HOV lanes at any time.",
   "tags": [
    "Licensing and law"
   ]
  },
  {
   "id": "q17",
   "prompt": "Is lane splitting (riding between lanes of traffic) legal in Washington?",
   "answers": [
    "No, it is against the law"
   ],
   "wrong": [
    "Yes, below 25 mph",
    "Yes, in stopped traffic",
    "Yes, on freeways"
   ],
   "explanation": "Riding between lanes and riding on the shoulder are both illegal.",
   "tags": [
    "Licensing and law"
   ]
  },
  {
   "id": "q18",
   "prompt": "Is riding on the shoulder to get past traffic legal in Washington?",
   "answers": [
    "No, it is against the law"
   ],
   "wrong": [
    "Yes, in stopped traffic",
    "Yes, below 10 mph",
    "Yes, on freeways only"
   ],
   "explanation": "Shoulder riding and lane splitting are both illegal.",
   "tags": [
    "Licensing and law"
   ]
  },
  {
   "id": "q19",
   "prompt": "Can two motorcycles legally ride side by side in one lane in Washington?",
   "answers": [
    "Yes, but it leaves no room to maneuver"
   ],
   "wrong": [
    "No, never",
    "Only on freeways",
    "Only in a group of three or more"
   ],
   "explanation": "It is legal, but the manual advises caution because it limits space and escape paths.",
   "tags": [
    "Licensing and law"
   ]
  },
  {
   "id": "q20",
   "prompt": "What kind of helmet does Washington law require on a motorcycle?",
   "answers": [
    "A DOT-compliant helmet"
   ],
   "wrong": [
    "Any helmet",
    "A Snell-certified helmet",
    "None for riders over 18"
   ],
   "explanation": "A DOT-compliant helmet is the legal minimum. Snell and ECE are optional extras.",
   "tags": [
    "Licensing and law"
   ]
  },
  {
   "id": "q21",
   "prompt": "Where do you find the label showing a helmet meets the DOT standard?",
   "answers": [
    "On the back of the outside and on the inside"
   ],
   "wrong": [
    "On the chin strap buckle only",
    "Only on the box it came in",
    "On the visor and the front of the shell"
   ],
   "explanation": "DOT labels are on the helmet’s rear exterior and its interior.",
   "tags": [
    "Protective gear"
   ]
  },
  {
   "id": "q22",
   "prompt": "May you wear a novelty helmet on public roads?",
   "answers": [
    "No, they are not DOT-compliant"
   ],
   "wrong": [
    "Yes, any helmet meets the law",
    "Yes, but only below 35 mph",
    "Yes, but only on a 3-wheeler"
   ],
   "explanation": "Novelty helmets do not meet the DOT standard and are not legal on 2- or 3-wheel motorcycles.",
   "tags": [
    "Licensing and law"
   ]
  },
  {
   "id": "q23",
   "prompt": "When does Washington law require eye protection?",
   "answers": [
    "Whenever the motorcycle has no windshield"
   ],
   "wrong": [